"Code","Name","Detail"
"  AEN 421","  ADVANCED AERODYNAMICS","s     NON LINEAR SUPERSONIC FLOWS Numerical techniques, method of characteristics, supersonic nozzle design, finite difference method, time dependent technique for supersonic blunt bodies, numerical problems  a     LAMINAR AND TURBULENT BOUNDARY LAYER  Laminar Compressible flow over a flat plate, reference temperature method, stagnation point aerodynamic heating, boundary layer over arbitrary bodies using finite difference method, Turbulent reference temperature method for flat plate, Meador-Smart reference temperature method, prediction of airfoil drag ,turbulence modeling, numerical problems     FLOW WITH SMALL PERTURBATIONS  One dimensional wave equation, D’ Alembert’s solution,2-D Subsonic and supersonic flow past a wavy wall, method of characteristics to unsteady 1-D homo entropic flow, uniform flow regions, simple wave regions and non simple wave regions, simple compression and expansion waves     BODIES OF REVOLUTION  Introduction, cylindrical coordinates, axially symmetric flow, subsonic flow, supersonic flow, solution for cone, and slender cone, yawed body of revolution in supersonic flow, cross flow solutions for slender body of revolution, lift of slender body of revolution, Rayleigh formula     SUPERSONIC AIRPLANE CONFIGURATIONS   Governing equations and boundary conditions, consequences of linearity, conical flow method for rectangular, swept, delta and arrow wings, singularity distribution method, design consideration for supersonic aircraft, aerodynamic interaction, supersonic analysis for complete configurations     HYPERSONIC FLOW  Qualitative aspects, Newtonian theory, lift and drag of wings at hypersonic speeds, hypersonic shock wave relations, mach no independence, hypersonic and CFD, high L/D hypersonic configurations, Aerodynamic heating, ground test data and flight test data           Course"
" AEN 422","   AUTOMATIC FLIGHT CONTRO"," INTRODUCTION 4 1 Classical and modern control theory, Open loop and closed loop (feedback) control systems, Types of feedback control systems FEEDBACK CONTROL SYSTEM 6 2 Transfer function of linear systems Impulse response of linear systems, Block diagrams of feedback control systems, Multivariable systems, Block diagram algebra SYSTEM STABILITY 6 3 Routh-hurwitz criterion, the root locus Method, Governing miles for plotting root locus, Effect of addition of Zeroes and Poles, Gain and phase margin from root locus ANALYSIS OF FEEDBACK CONTROL SYSTEMS 6 4 Typical test input signals, Frequency domain techniques, Time domain performance characteristics of feedback control systems Effects of derivative and integral control Steady state response of feedback control system, Steady state error, Frequency response CONTROL SYSTEM DESIGN 6 5 Control system design, Compensation, Forward-path compensation, Feedback-path compensation, Proportional, proportional-integral and proportional-integral-derivative (P, PI and PID) controller LONGITUDINAL AUTO-PILOTS 8 Short period and phugoid dynamics, Longitudinal auto pilots Brief description through 6 block diagrams and root locus, Displacement autopilot, pitch-displacement autopilot, Acceleration control system, Fly-By-Wire control system, Stability augmentation system, Instrument Landing System LATERAL AUTO-PILOTS 6 7 Introduction, Roll dynamics, Dutch roll approximation, Damping of Dutch Roll, Roll attitude autopilot, Methods of obtaining coordination, Yaw orientation control system Course"
" AEN 423","   AIRCRAFT DESIGN  OPTIMIZATIO"," DESIGN OF AIRCRAFT FUSELAGE 8 1 Specifications, aircraft data, initial calculations of flight envelope, balancing out calculations, fuselage loads, self weight, skin thickness, rivet size DESIGN OF AIRCRAFT WING 8 2 Specifications, airfoil data, selection of airfoil, estimation of wind span, weight, lift and drag estimation, stalling, take-off and landing considerations, taper ratio, wing plan form, skin, rivets, joining with fuselage, engine locations, location of flaps and ailerons DESIGN OF TAILPLANE 8 3 Specifications, airfoil selection for horizontal and vertical surfaces, shapes of tail planes, criteria for selection of tail plane, size of elevators and rudder, location of elevators and rudder DESIGN OF LANDING GEAR 7 4 Specifications, different arrangements, mechanism for retraction into fuselage and wing , oleo strut, linkages, calculations of loads, location under fuselage and wings INTEGRATION 7 5 Joining methods of wing- fuselage, fuselage-tail plane, wing-engines, flaps, ailerons, elevators and rudder 6 MODERN CONCEPTS IN AIRPLANE DESIGN 4 Super critical wing, relaxed stability, control configured vehicles Course"
" AEN 424","  DYNAMICS OF AEROSPACE STRUCTURES","s     EQUILIBRIUM OF FORCES Two force members, analysis of typical space structures, stress analysis of landing gear, stress analysis of wing structure, numerical problems  7     INERTIA FORCES AND LOAD FACTORS  Numerical problems on pure translation motion, inertia forces on rotating bodies, load factors for translational acceleration, load factor for angular acceleration, numerical problems     SPECIAL METHODS OF ANALYSIS Area moments, conjugate beam method, beam columns, superposition of beam column loadings, moment distribution method, numerical problems     FAILURE CRITERIA OF ISOTROPIC STRUCTURES  Fracture mechanics, stress concentration, fracture criterion, stress intensity factor, symmetrical and unsymmetrical loading, relation between K and G, mixed mode fracture, fatigue failure, constant stress amplitude, S-N curves, variable amplitude loading, fatigue crack growth     STRUCTURAL VIBRATIONS Oscillation of mass spring systems, numerical problems, oscillation of beams, numerical problems, approximate methods for determining natural frequencies     ELASTIC BUCKLING OF THIN PLATES  Equilibrium approach, boundary conditions, numerical problems with different boundary conditions and loadings , Energy approach, Rayleigh Ritz method, Galerkin’s method, numerical problems with different loadings            Course"
"  AEN 425"," é ADVANCED AEROSPACE PROPULSION SYSTEMS","s     AIRCRAFT GAS TURBINES  Impulse and reaction blading of gas turbines — Velocity triangles and power output — Elementary theory — Vortex theory — Choice of blade profile, pitch and chord — Estimation of stage performance — Limiting factors in gas turbine design- Overall turbine performance — Methods of blade cooling — Matching of turbine and compressor — Numerical problems  8     RAMJET PROPULSION  Operating principle — Sub critical, critical and supercritical operation — Combustion in ramjet engine — Ramjet performance — Sample ramjet design calculations — Introduction to scramjet — Preliminary concepts in supersonic combustion — Integral ram- rocket- Numerical problems     FUNDAMENTALS OF ROCKET PROPULSION Operating principle — Specific impulse of a rocket — internal ballistics- Rocket nozzle classification — Rocket performance considerations — Numerical Problems     CHEMICAL ROCKETS  Solid propellant rockets — Selection criteria of solid propellants — Important hardware components of solid rockets — Propellant grain design considerations — Liquid propellant rockets — Selection of liquid propellants — Thrust control in liquid rockets — Cooling in liquid rockets — Limitations of hybrid rockets — Relative advantages of liquid rockets over solid rockets- Numerical Problems     ADVANCED PROPULSION TECHNIQUES Electric rocket propulsion — Ion propulsion techniques — Nuclear rocket — Types — Solar sail- Preliminary Concepts in nozzle-less propulsion, Pulse detonation propulsion     10        Course"
"  AEN 431"," é INTRODUCTION TO AEROSPACE ENGINEERING"," INTRODUCTION 7 1 Pre Wright Brothers era, Wright Flyer, Conventional airplane, progress in airplane design and applications, Current status Other kinds of heavier than air vehicles, helicopter, VSTOL machines SPACE VEHICLES 5 2 Missile and its types, space vehicles and its types, reusable space vehicles, space shuttle ,satellites, types of satellites and their functions AERODYNAMICS 10 Airfoil nomenclature, symmetric  cambered airfoils and their aerodynamic characteristics, angle of attack, 2-D and 3-D wing, wing as a lifting surface, types of wing planforms and 3 their aerodynamic characteristics, centre of pressure and pressure coefficient,types of drag, lift to drag ratio as efficiency of a lifting surface, different types of flows laminar and turbulent, effect of viscosity, concept of boundary layer, boundary layer control, high coefficient of lift devices,subsonic,transonic,supersonic and hypersonic mach no,critical mach no, drag divergence mach no AIRPLANE PROPULSION 8 4 Requirement of power to fly, balance of forces, various means of producing power for forward flight, piston engines jet propulsion-thrust equation,turbojet,turbofanramjet engines Locations of such engines, Propellor and its use Rocket engines AIRPLANE STRUCTURES AND MATERIALS 8 5 Structural arrangement of the Wright Flyer, Structural details of landing gear, wing, fuselage and tail planes, functions of ribs,skin,spars,stringerslongerons Monocoque and semi- monocoque structures, materials for main components, composite materials CONTROL SYSTEMS AND LEVEL FLIGHT 4 6 Various types of flaps, function of rudder, elevator, ailerons, flaprons, elevons, types of tail  planes,condition for straight  level flight, flight path angle           Course"
" AEN 432"," AIRCRAFT STRUCTURES","s     BASIC ELASTICITY  Equations of equilibrium, plane stress, stresses on inclined planes, principal stresses, compatibility equations, plane strain, principal strains, stress-strain relationship, numerical problems, 2- D problems, stress functions, bending of end loaded cantilever  Ti     STATICALLY DETERMINATE AND INDETERMINATE STRUCTURES  Statically determinate and indeterminate trusses Truss analysis by method of joints, Truss analysis with single and double redundancy, other structures with single redundancy, shear center     MATRIX METHODS  Introduction of flexible and stiffness methods, choice of method , stiffness matrix for elastic springs, analysis of pin jointed framework, stiffness matrix for uniform beams Finite Element Method for continuum structures     ELASTIC BUCKLING OF COLUMNS AND PLATES  Buckling load of Euler columns with different end conditions, beam columns, effect of initial imperfections, pure bending of thin plates, plates subjected to distributed transverse loads     LOADS ON AIRCRAFT Pure translation, inertia forces on rotating bodies, load factors for translational acceleration, load factors for angular acceleration, numerical problems     ANALYSIS OF AIRCRAFT COMPONENTS  Loads on structural components, functions of structural components, fabrication of structural components, connections, V-n diagram, Gust loads, crack propagation, stress concentration factor, crack tip plasticity, crack propagation rates"
"  AEN 433","  ELEMENTS OF AERODYNAMICS","  INTRODUCTION 10 Fluid statics, Continuum and free molecular flows, inviscid and viscous flows, incompressible  1 and compressible flows Newtonian and Non-Newtonian flows Streamlines, Pathlines, Streaklines, Pitot static tube, measurement of air-speed, pressure coefficient Aerodynamic force and moments Dimensional analysis, non-dimensional parameters, Mach number, Reynolds number, flow similarity KINEMATICS OF FLUID FLOW 6  2 Lagrangian and Eulerian methods, Description of properties in a moving fluid, Gradient of a scalar field , Divergence and Curl of a vector field, Line, Surface and Volume integrals and their relationship ,Finite control volume and molecular approach, Divergence of velocity DYNAMICS OF FLUID FLOW 10 Equation of conservation of mass for control volume, special form of equation of conservation  3 of mass, differential form of equation of conservation of mass, Euler's and Navier-Stoke equations Derivation of Bernaulli's equation for inviscid and viscous flow fields Momentum equation in integral form Application of momentum equation INVISID-INCOMPRESSIBLE FLOW 10 Incompressible flow in a duct , Condition on velocity for incompressible flow Laplace's  4 equations Vorticity and circulation ,Potential function, stream function Basic elementary flows Uniform flows, source flow, Doublet flow and Vortex flow Superimposition of elementary flows Non lifting and lifting flow over a circular cylinder, comparison with real flow over circular cylinder Kutta-Joukowski theorem, generation of lift BOUNDARY LAYER THEORY 6  5 Boundary layer concept, boundary layer properties, derivation of Prandtl's boundary layer equations, Blasius solution, Karman's Integral equation Turbulent boundary layer over a plate, skin friction drag, boundary layer control  « e Number of"
" AEN 434"," AIRCRAFT PERFORMANCE","s     THE STANDARD ATMOSPHERE AND AIRFLOW  Standard atmosphere, Relation between geo-potential and geometric altitudes, Pressure, temperature and density altitudes Relations for isothermal and gradient atmospheric regions, Stability of atmosphere, Measurement of air-speed Indicated airspeed, Calibrated airspeed, Equivalent airspeed and True airspeed, Airspeed indicator  6     AERODYNAMIC DRAG  Drag, Causes of drag, Types of drag, Factors affecting drag Drag polar, Compressibility drag, Design for minimum drag, Estimation of drag of complete airplane for subsonic and supersonic cases, Terminal velocity     AERODYNAMIC CHARACTERISTICS  Force and Moment coefficients from dimensional analysis and their variation with angle of attack, Lift, Drag and moment coefficients, Relations between lift and drag, Aerodynamic center, Center of pressure, Pressure distribution over 2-D airfoil, Estimation of aerodynamic characteristics from measured pressure distribution, Variation of aerodynamic coefficients with Reynold's Number and Mach number, Effect of span, aspect ratio, plan form, sweep, taper and twist on aerodynamic characteristics of a lifting surface, Delta wing aerodynamics        HIGH LIFT DEVICES Maximum lift coefficient of airfoils, Leading and trailing edge devices, The deep stall,Propulsive lift, V/STOL configurations           AIRCRAFT PERFORMANCE IN STEADY FLIGHT 8  Straight and Level flight, Variation of drag with flight speed, Minimum drag conditions, 5 Variation of power with flight speed, Minimum power conditions, Gliding flight, Shallow  and steep angles of glide, Sinking speed, Minimum sinking speed, Time of descent,  Climbing flight at shallow angles, Correction for steep angles, Time to flight, Maximum rate  of climb  AIRCRAFT PERFORMANCE IN ACCELERATED FLIGHT 8 6 Take-off and landing, Calculation of take-off ground run and take off distances, Minimum  ground run, Assisted take-off, Calculation of landing ground run and landing distances,  Range and endurance, Numerical problems  MANEUVERS ENERGY METHODS 4 7 Maneuvering performance, Introductory comments on spins and stalls, Analysis of Spin,  Various types of stalling behaviour of wings, Turning flight, Maneuvers in 3-D space, Karman’s method of JATO, Energy method of performance calculations           Course"
" AEN 435"," AIRCRAFT PROPULSION"," REVIEW OF BASIC THERMODYNAMICS 8  Basic thermodynamics, Processes, Gas laws and Properties Enthalpy, pressure temperature, entropy Introduction to heat transfer, heat exchangers Introduction to propulsionAIRCRAFT PISTON ENGINES  The internal combustion engine process, brief history, GI and CI engines,4-stroke and 2- stroke engines, air standard cycles, various types of arrangements for multi cylinder aircraft engines ,their merits and operational efficiencies, cooling, lubricating and ignition systems, valve timing diagrams, IHP, BHP and SH-P, performance, effect of altitude, power required and power available, supercharging  10     AIRCRAFT GAS TURBUNE ENGINES  Air standard Brayton cycle, actual gas turbine engine cycle, compressor and turbine efficiencies , compressor and turbine work, centrifugal and axial type of compressors, their compressive action, relative merits in operations, combustion chambers, simplex and duplex burners, expansion process, turbine materials for different components, engine intake and exhaust nozzles, afterburners, thrust augmentation, turboprop, turbo shaft and turbofan engines, multi shaft gas turbine engines, thrust equation, installed and uninstalled thrust  10     PROPELLERS Ideal momentum theory, blade element theory, activity factor, airscrew coefficients, numerical problems on the performance of propellers, selection of propellers, fixed, variable and constant speed propellers, material for propellers, momentum theory applied to helicopter rotor  10     OTHER PROPULSION SYSTEMS Introduction to other propulsion systems such as Ram jet, Scram jet, Rocket propulsion, Pulse detonation engine, electric and hybrid propulsion"
" AEN 461"," AIRCRAFT PERFORMANCE","s     THE STANDARD ATMOSPHERE AND AIRFLOW  Standard atmosphere, Relation between geo-potential and geometric altitudes, Pressure, temperature and density altitudes Relations for isothermal and gradient atmospheric regions, Stability of atmosphere, Measurement of air-speed Indicated airspeed, Calibrated airspeed, Equivalent airspeed and True airspeed, Airspeed indicator  6     AERODYNAMIC DRAG  Drag, Causes of drag, Types of drag, Factors affecting drag Drag polar, Compressibility drag, Design for minimum drag, Estimation of drag of complete airplane for subsonic and supersonic cases, Terminal velocity     AERODYNAMIC CHARACTERISTICS  Force and Moment coefficients from dimensional analysis and their variation with angle of attack, Lift, Drag and moment coefficients, Relations between lift and drag, Aerodynamic center, Center of pressure, Pressure distribution over 2-D airfoil, Estimation of aerodynamic characteristics from measured pressure distribution, Variation of aerodynamic coefficients with Reynold's Number and Mach number, Effect of span, aspect ratio, plan form, sweep, taper and twist on aerodynamic characteristics of a lifting surface, Delta wing aerodynamics        HIGH LIFT DEVICES Maximum lift coefficient of airfoils, Leading and trailing edge devices, The deep stall, Propulsive lift, V/STOL configurations     AIRCRAFT PERFORMANCE IN STEADY FLIGHT  Straight and Level flight, Variation of drag with flight speed, Minimum drag conditions, Variation of power with flight speed, Minimum power conditions, Gliding flight, Shallow and steep angles of glide, Sinking speed, Minimum sinking speed, Time of descent, Climbing flight at shallow angles, Correction for steep angles, Time to flight, Maximum rate of climb     AIRCRAFT PERFORMANCE IN ACCELERATED FLIGHT  Take-off and landing, Calculation of take-off ground run and take off distances, Minimum ground run, Assisted take-off, Calculation of landing ground run and landing distances, Range and endurance, Numerical problems     MANEUVERS ENERGY METHODS  Maneuvering performance, Introductory comments on spins and stalls, Analysis of Spin, Various types of stalling behaviour of wings, Turning flight, Maneuvers in 3-D space, Karman’s method of JATO, Energy method of performance calculations           Course"
"  AEN 462","  AIRCRAFT STRUCTURES"," BASIC ELASTICITY 7 1 Equations of equilibrium, plane stress, stresses on inclined planes, principal stresses compatibility equations ,plane strain ,principal strains, stress-strain relationship, numerical problems, 2- D problems, stress functions, bending of end loaded cantilever STATICALLY DETERMINATE AND INDETERMINATE STRUCTURES a 2 Statically determinate and indeterminate trusses Truss analysis by method of joints, Truss analysis with single and double redundancy, other structures with single redundancy, shear center MATRIX METHODS 7 3 Introduction of flexible and stiffness methods, choice of method stiffness matrix for elastic springs, analysis of pin jointed framework, stiffness matrix for uniform beams Finite Element Method for continuum structures ELASTIC BUCKLING OF COLUMNS AND PLATES 7 4 Buckling load of Euler columns with different end conditions, beam columns, effect of initial imperfections, pure bending of thin plates, plates subjected to distributed transverse loads LOADS ON AIRCRAFT a 5 Pure translation, inertia forces on rotating bodies, load factors for translational acceleration, load factors for angular acceleration, numerical problems ANALYSIS OF AIRCRAFT COMPONENTS a 6 Loads on structural components, functions of structural components, fabrication of structural components, connections, V-n diagram, Gust loads, crack propagation, stress concentration factor, crack tip plasticity, crack propagation rates Course"
"  AEN 463","  SPACE DYNAMICS"," PRINCIPLE OF ROCKET PROPULSION a Thrust, specific impulse, exhaust velocity, energy and efficiency, Tsiolkovsky’s rocket 1 equation, orbits, optimising a multistage rocket, optimising the rocket engines, strap-on boosters, Solar system, the planets, reference frames and coordinate systems, celestial sphere, the ecliptic, geocentric reference frames, velocity vector LAUNCH VEHICLE DYNAMICS 8 Range in the absence of gravity, Vertical motion the Earth’s gravitational field, Vehicle velocity, Range, Inclined motion in a gravitational field, Constant pitch angle, The flight 2 path at constant pitch angle, Motion in the atmosphere, Aerodynamics forces, Dynamic pressure, The gravity turn, Basic launch dynamics, Airless bodies, Typical Earth- launch trajectories, The vertical segment of the trajectory, The gravity turn or transition trajectory, constant pitch or the vacuum trajectory, Orbital injection, Actual launch vehicle trajectories, SPACE FLIGHT 8 Introduction, differential equations, Lagrange’s equation, orbit equation, space vehicle 3 trajectory, Kepler’s laws, introduction to earth and planetary trajectory, general equations of motion for atmospheric entry, application to ballistic entry Entry heating, lifting entry with application to Space Shuttle THE EARTH SATELLITE OPERATIONS 6 4 The Hohmann transfer, inclination-change maneuver, launch to rendezvous, decay life time, earth oblateness effect, low thrust orbit transfer SATELLITE ATTITUDE DYNAMICS 6 5 Torque —Free-axisymmetric rigid body, The general torque free rigid body, semi-rigid space craft, attitude control, Spinning and Non spinning space craft The Yo-Yo mechanism, gravity gradient satellite, the dual spin space craft INTERPLANETARY MISSIONS 7 6 Basic concepts, 2-D interplanetary trajectories, Hohmann trajectories, launch opportunities, fast interplanetary trajectories, 3-D interplanetary trajectories, launch of interplanetary spacecraft, trajectory about target planet Course"
" AEN 464"," INTRODUCTION TO AEROSPACE ENGINEERING","s     INTRODUCTION  Pre Wright Brothers era, Wright Flyer, Conventional airplane, progress in airplane design and applications, Current status Other kinds of heavier than air vehicles, helicopter, VSTOL machines  7     SPACE VEHICLES Missile and its types, space vehicles and its types, reusable space vehicles, space shuttle , satellites, types of satellites and their functions     AERODYNAMICS  Airfoil nomenclature, symmetric  cambered airfoils and their aerodynamic characteristics, angle of attack, 2-D and 3-D wing, wing as a lifting surface, types of wing planforms and their aerodynamic characteristics, centre of pressure and pressure coefficient, types of drag, lift to drag ratio as efficiency of a lifting surface, different types of flows laminar and turbulent, effect of viscosity, concept of boundary layer, boundary layer control, high coefficient of lift devices, subsonic, transonic, supersonic and hypersonic mach no, critical mach no, drag divergence mach no  10     AIRPLANE PROPULSION  Requirement of power to fly, balance of forces, various means of producing power for forward flight, piston engines jet propulsion-thrust equation, turbojet, turbofan, ramjet engines Locations of such engines, Propellor and its use Rocket engines     AIRPLANE STRUCTURES AND MATERIALS  Structural arrangement of the Wright Flyer, Structural details of landing gear, wing, fuselage and tail planes, functions of ribs, skin, spars, stringers, longerons Monocoque and semi- monocoque structures, materials for main components, composite materials     CONTROL SYSTEMS AND LEVEL FLIGHT Various types of flaps, function of rudder, elevator, ailerons, flaprons, elevons, types of tail planes, condition for straight  level flight, flight path angle           Cours  e"
