"Code","Name","Detail"
"  ESC 103","  INTRODUCTION TO MANUFACTURING","  INTRODUCTION 3  1 Classification of manufacturing processes, classification of engineering materials, comparison of material properties of metals, ceramics and plastics, crystal structures, strain hardening effects, stress-strain curves Safety measures in workshop MATERIALS AND HEAT TREATMENT 4  2 Objective of heat treatment, classification of heat treatment, annealing, normalizing, hardening  tempering, case hardening, carburizing, nitriding, flame hardening, induction hardening, applications of heat treatment FOUNDRY 4 Pattern, properties of pattern material, types of pattern, cores Types of sand, moulding sand  3 ingredients Types of moulding processes Types of casting processes sand casting, shell  casting, investment casting and centrifugal casting Casting defects  remedies Case studies and applications        FORMING 3 4 Metal forming, types and applications, hot  cold working, forging, drawing, rolling and sheet metal operationsMACHINING 3  5 Metal removal processes, machines, single-point tool, cutting tool geometry, lathe - types, elements and main parts of lathe, drilling, milling and grinding machines Applications FINISHING 2  6 Surface finishing processes, principle and applications, lapping, honing, super finishing, polishing, buffing, electroplating, galvanizing  WELDING 3  7 Classification of welding processes, mechanism of arc formation, arc welding processes, gas welding, and resistance welding, principles and applications, welding defects, causes and remedies Soldering and brazing Applications and case studies in welding  PLASTICS MANUFACTURING 2  8 Types and properties of plastics, thermosetting and thermoplastic resins, elastomers Fabrications of plastics, injection moulding, blow moulding, extrusion moulding etc  MODERN MANUFACTURING PROCESSES 2  9 Introduction, classification, electric discharge machining (EDM), electro chemical machining (ECM), laser beam machining (LBM) and Rapid Prototyping Techniques Case studies on modern and hybrid manufacturing processes  CASE STUDIES 2  10 Considerations of selecting manufacturing processes for industrial products like compact disc, PCB and emerging technological applications  z Z Number of"
"  ESC 201","  THERMODYNAMICS","     BASIC CONCEPTS Macroscopic and Microscopic Approach, Concept of Continuum,  8 Thermodynamic System, Surrounding and Boundary, Thermodynamic Equilibrium, State, 1 Path, Process, cycle, Quasi-static Process, Reversible and Irreversible Process, Working Substance Thermodynamic Properties like Pressure, Volume and Temperature, Zeroth Law of Thermodynamics Temperature Scales, Concept of Heat and work in Thermodynamics     FIRST LAW OF THERMODYNAMICS Joule’s Paddle wheel Experiment Mechanical  6 Equivalent of Heat, First Law for a closed system undergoing a Cycle, First Law for a closed     2 system undergoing a change of state Different forms of stored Energy, Enthalpy, Energy of  An isolated System, Perpetual Motion Machine of First kind  FIRST LAW APPLIED TO FLOW PROCESSES Flow Process and Control  5 3 Volume, flow work, Steady and Unsteady Flow Process, Steady Flow Energy Equation,  Engineering Applications of Steady Flow Energy Equation, Throttling Process, Flow Work and Non Flow work, Variable flow Processes, Limitation of First Law     SECOND and THIRD LAW OF THERMODYNAMICS Qualitative Difference between  8 Heat and Work, Thermal Reservoir, Statements of 2nd Law by Max-Planck and Claussius, 4 Equivalence between two statements, Energy Analysis of Heat Engine, Refrigerator and Heat Pump Reversibility and Irreversibility, Causes of Irreversibility Carnot Theorem, Carnot cycle, Absolute Thermodynamic Temperature, Scale, Efficiency of the Reversible Heat Engine, Equality of Ideal Gas Temperature and Kelvin Temperature     ENTROPY Classius Theorem, Classius Inequality and concept of Entropy, Entropy change  5 in an Irreversible Process, Application of Entropy Principle, Entropy Transfer with Heat 5 Flow, Entropy generation in closed and open System, Thermodynamics Equations relating properties of System, Reversible Adiabatic work in a Steady flow System Entropy and direction, Entropy and disorder     PROPERTIES OF GASES AND GAS MIXTURE  Equation of state of a gas, Properties  3 6 of Mixture of gases, Internal Energy, Enthalpy and Specific heat of gas, mixtures, Entropy of gas Mixtures     STEAM GENERATORS Classification of steam generators, Boiler mountings and  7 accessories Principles and operations of steam accumulators Description of Cochran, Locomotive, Lancashire, Babcock and Wilcox boiler, Modern high pressure boilers, Characteristics and advantages of high pressure boilers     BASIC CONCEPTS Macroscopic and Microscopic Approach, Concept of Continuum,  8 Thermodynamic System, Surrounding and Boundary, Thermodynamic Equilibrium, State, 8 Path, Process, cycle, Quasi-static Process, Reversible and Irreversible Process, Working Substance Thermodynamic Properties like Pressure, Volume and Temperature, Zeroth Law of Thermodynamics Temperature Scales, Concept of Heat and work in Thermodynamics        FIRST LAW OF THERMODYNAMICS Joule’s Paddle wheel Experiment Mechanical  6 Equivalent of Heat, First Law for a closed system undergoing a Cycle, First Law for a closed system undergoing a change of state Different forms of stored Energy, Enthalpy, Energy of An isolated System, Perpetual Motion Machine of First kindCourse"
"  ESC202","  ESSENTIALS OF INFORMATION TECHNOLOGY","s     NETWORKING AND COMMUNICATION  Introduction to digital communication Signal propagation, signal types, signal parameters, Channel effect on transmission Physical layer characterization Types of transmission media, physical layer interfaces Data transmission mechanisms Communication modes, transmission modes, synchronization, introduction to packet switching, multiplexing, error control methods Network architectures Introduction to computer networks, Network topologies, Types of networks LAN, WAN, MAN, layered network model Internet Protocols Introduction, Transport layer protocols TCP, UDP Application layer protocols DNS, SMTP, POP, IMAP Practical aspects of networking  12     RELATIONAL DATABASE MANAGEMENT SYSTEM  RDBMS- data processing — the database technology — data models- ER modeling concept — notations — converting ER diagram into relational schema - Logical database design - normalization (INF, 2NF and 3NF) SQL — DDL statements - DML statements - DCL statements - Joins - Sub queries — Views - Database design Issues — SQL fine tuning  10     WEB TECHNOLOGIES AND INTRODUCTION TO USER INTERFACE AND WEB TECHNOLOGIES  web fundamentals — types web content - HTML — text formatting tags in HTML — HTML form elements - <div> and <span> tags - text formatting using CSS  embedded CSS, inline CSS and external CSS — JavaScript and its features  10        SOFTWARE ENGINEERING  Software Engineering  Definition — role of software and software crisis - SDLC models  waterfall model, incremental model and spiral model — software testing — static  dynamic testing — types testing  unit testing, integration testing, system testing, performance testing and regression testing        10        Course"
"  ESC 203","  MATERIALS SCIENCE","s     INTRODUCTION  Historical perspective, Scope of Materials Science and engineering, Geometry of crystals, Structure determination by X-Ray Diffraction, Atomic structure and chemical bonding, Structure of solids  10     IMPERFECTIONS IN ATOMIC AND IONIC ARRANGEMENTS Point defects, Dislocations, Significance of Dislocations, Influence of Crystal structure, Surface defects, Importance of defects     PHASE DIAGRAMS  Phase rule, Single component systems, Binary Phase diagrams, Microstructural changes during cooling, The lever rule, Some typical phase diagrams, Other applications of Phase diagrams     DIFFUSION IN SOLIDS  Applications of Diffusion, Stability of atoms and ions, Mechanism for Diffusion, Activation energy for Diffusion, Rate of Diffusion (Fick’s First Law), Factors affecting Diffusion, Composition Profile (Fick’s Second Law), Diffusion and Materials Processing     SOLIDIFICATION  Nucleation, Applications of Controlled Nucleation, Growth mechanisms, Solidification time and Dendrite size, Cast structure, Solidification defects, Solidification of Polymers and Tnorganic glasses     ELASTIC, ANELASTIC AND VISCOELASTIC BEHAVIOUR Atomic model of elastic behaviour, The modulus as a parameter in design, Rubber-like elasticity, Relaxation processes, Spring-Dashpot model     MECHANICAL BEHAVIOUR OF MATERIALS Plastic deformations and creep in crystalline materials, Fracture        ELECTRONIC AND MAGNETIC BEHAVIOUR OF MATERIALS Conductivity of metals and alloys, Superconductivity, Semiconductors and their applications, Insulators and Dielectrics, Classification of magnetic materials, Magnetization,Permeability and magnetic field, Applications of magnetic materials     OVERVIEW OF MATERIALS Metals, Ceramics, polymers and composites           Course"
"  ESC 204","  SOLID MECHANICS","s     PROPERTIES OF MATERIALS  Introduction, uni-axial tension test, idealized stress- strain diagrams, isotropic, linear, elastic, visco-elastic and plastic materials, compression test, impact test, fatigue test, torsion and bending test  4     SIMPLE STRESSES  STRAINS  Concept of stresses and strains, relationship between elastic constants, extension of uniform bar  tapered bar under its own weight and due to load applied, stresses produced in compound bars due to axial loads, thermal stresses,     COMPOUND STRESSES General state of stress, resultant stress and strain circle, prinicipal stresses and principal strains, Mohercircle for compound stresses and strais     SHEAR FORCE AND BENDING MOMENT IN BEAMS Shear force, bending moment, Relation between load, SF and BM, SFD , BMD and axial force diagram for determinate beams under various types of loading        BENDING AND SHEAR STRESSES IN BEAMS  Pure bending ,bending stresses, eccentric loading combined bending and direct stresses , Middle Third rule, composite beams, Variation of shear stresses for various cross-sections of a beamANALYSIS OF PLANE TRUSSES 5 6 Different types of trusses, Analysis of plane trusses by method of joints and method of  sections  TORSION 4 7 Torsion equation for circular shaft , shafts under action of varying torque, torsion of  composite shafts  COLUMNS  STRUTS 5 8 Criteria for stability of columns, Buckling of columns, Euler’s theory for various end  restraints, Rankine's formula, eccentrically loaded struts, struts with initial curvature, struts  with lateral loading  DEFLECTION OF BEAMS 5 9 Slope and Deflection in beams by double integration method, Macaulay’s method, Moment  area method under the action of various loading conditions slope and deflection in built in  and propped beams Course"
"  ESC 205","  INTRODUCTION TO ELECTRONICS"," INTRODUCTION TO ELECTRONICS Need and application of electronics in different  3     areas, Basic elements of electronic system (Active and Passive elements, Sources,Dependent Sources), KVL and KCL     SEMICONDUCTOR DEVICES Concept of active and passive devices, Semiconductor Devices Structure, principle of operation, characteristics and applications of PN-Junction (Rectifier, Clipper and Clamper), BJT, Current Components in BJT, Input  Output characteristics Common Emitter (CE), Common Base (CB), Common Collector (CC) configurations, BJT as an amplifier, Construction, working principle and characteristics of FET and MOSFET, Concept of feedback amplifier, Barkhuasen criteria, Oscillators, 555 timer as multivibrator, Four layer devices- SCR, DIAC and TRIAC (Construction, operation and characteristics)     15     DIGITAL PRINCIPLES Digital waveforms, digital logic, moving and storing digital information, digital operations, digital integrated circuits     OPERATIONAL AMPLIFIER AND ITS APPLICATIONS Block diagram, characteristics, inverting and non inverting configurations, Opamp as summing amplifier, difference amplifier, integrator, differentiator     A/D AND D/A CONVERTERS Basic principle and characteristics, Weighted resistor D/A converter, Binary ladder D/A converter, counter ramp type A/D Converter     INTRODUCTION TO MICROPROCESSOR Pin diagram, Architecture of 8085 Microprocessor, Concept of Microcontroller and its applications     COMMUNICATION SYSTEMS Introduction to communication system, communication time line, Various frequency bands used for communication, Block diagram of Analog and Digital communication, need of modulation, Analog modulation techniques (Amplitude and frequency), Digital modulation techniques (PCM,PWM,PPM, PAM, ASKFSK,PSK, QAM), Introduction to advanced communication systems (Optical and wireless)           Course"
" ESC 206","  BASIC ELECTRICAL SCIENCES"," BASIC DEFINITIONS AND NETWORK THEOREMS 8  1 Basic definitions of voltage, current, power and energy Nodes, branches, loops, mesh, Kirchhoff ‘s laws, nodal  mesh analysis Circuit theorems linearity, superposition,  Norton, thevenin, max power transfer AC CIRCUITS 10 Introduction, Generation of alternating voltage, sinusoidal waveform, phasor diagram, power relations in AC circuits, single phase AC circuits, Steady State Analysis Nodal and Mesh analysis, Thevenin's, Norton's, Maximum Power Transfer theorems AC Power Analysis  2 Instantaneous and average power, max average power transfer, RMS value, apparent power and power factor, complex power, conservation of AC power THREE PHASE CIRCUITS Phase sequence, Star and delta connection, Relation between line and phase voltages and currents in balanced systems, Analysis of balanced and Unbalanced three phase circuits, Measurement of active and reactive power  MAGNETICALLY COUPLED CIRCUITS 2  3 Mutual Inductance, Energy in a coupled circuit Transformer  construction, equivalent circuit, voltage regulation, efficiency, OC and SC tests  DC MACHINES 5  4 Construction, emf and torque equations, circuit model, methods of excitation, characteristics of generators and motors, starting and speed control of de motors, starters, losses, efficiency  AC MACHINES 10 Rotating magnetic field theory, three phase induction machines General construction features, per phase equivalent circuit, approximate equivalent circuit, production of torque,  5 slip, torque speed characteristics, no load and blocked rotor test to determine performance parameters, Starting rotor rheostat starter, reduced voltage starting, star delta starting, centrifugal start Synchronous motors types, salient pole and cylindrical rotor, emf equation  Principle of operation of single phase induction motor, types and applications BASIC MEASURING INSTRUMENTS 4  6 Introduction, Classification of instruments, essential features and operating principles, moving coil and moving iron instruments  z Z Number of"
"  ESC 207","  MECHATRONICS","s     INTRODUCTION TO MECHATRONICS  Understanding Mechatronics Key Elements of Mechatronics, Components of Mechatronics -Human Being and Mechatronic System, Conventional and Mechatronic Approach, Advantages of Mechatronic Systems Definition of System, Classification of System, Mechanistic System, Mechatronic System Intelligence  04     SENSOR AND TRANSDUCERS PRINCIPLES AND APPLICATIONS  Role of Sensors and transducers in Mechatronics System , selection of sensors based on performance characteristics, static and dynamic characteristics) calibration types of sensors , resistive transducers, inductive ,capacitive optical , thermal Transducer and their applications Measurement of  linear , angular position, displacement, rotational speed, force, pressure, strain, flow rate, temperature etc  08     SIGNAL CONDITIONING DEVICES  Role of signal conditioning Processes and devices in mechatronics, passive elements (RLC), semiconductors devices (PN junction diodes, AC rectification, Zener diode, Power supplies, transistors, Transistor (common emitter characteristics, emitter, follower circuit, FET) thyristor, TRIAC,DIAC, operational amplifiers (inverting, unity gain, non-inverting, C/V and V/C amplifiers, differential amplifier, instrumentation amplifier)Filters types of filters  SIGNAL CONVERTING DEVICES Digital to analog converter (DAC) and Analog to Digital Converter (ADC), multiplexer  09     DIGITAL ELECTRONICS  Boolean algebra digital electronic gates combination logic systems (simple gates, NAND and NOR gates, latches, positive and negative logic, tri-state logic) sequential logic systems (JI-K flip-flop, registers and counter, timers and pulse circuits)  05        MICROPROCESSORS , MICROCONTROLLERS AND PLC’S  Fundamentals of microprocessor , the 8085, concept of interfacing memory, input /output devices , fundamentals of Microcontroller, T he 8051, PLC Hardware, PLC Memory structure, application        07ACTUATORS 07 Role of actuators in mechatronics, types of actuators, electrical actuators Physical principles 6 solenoid-type devices DC machines AC machines stepper motors Drive Technology Applications Linear motors voice coil motors electro-pneumatic and electro-hydraulic actuators Mechanical actuators Rotary to linear motion conversion power transmission, Electromechanical System Applications, Coupling, gearing, belts, pulleys, bearings 7 CASE STUDIES 02 Washing Machines, auto focusing camera, pick and place robot « Number of"
"  ESC","  MECHANICAL ENGINEERING DRAWING"," INTRODUCTION TO ENGINEERING GRAPHICS System of Projections Technical 3 1 lettering Drawing conventions, Orthographic projections 3-views Projection of oblique  areas Circular features Dimensioning, Rules of dimensioning     ISOMETRIC PROJECTIONS General introduction to Isometric Projections Conversion  3           2 from orthographic to isometric projections and vice-versa Freehand sketching  3 Projections of Points, Lines and Planes Geometrical Constructions 5  4 Projection of Solids, sectioning Auxiliary planes and views 3 REQUIREMENTS OF MECHANICAL ENGINEERING DRAWINGS Conventional 3  5 representation, Layout of drawing sheet, symbols of standard tolerances, machining symbols Introduction and familiarization of the code IS296     FASTENERS Temporary and Permanent fasteners Various types of screw threads, nuts 3        6 and bolts, screws, welding joints and riveted joints 7 INTRODUCTION TO AUTOCAD Basic commands and features, simple exercises of 3 points, lines, planes and solids on AutoCAD ASSEMBLY AND DIS-ASSEMBLY DRAWING EXERCISES ON SOME OF THE 5 8 FOLLOWING USING DRAWING SHEETS AS WELL AS AUTOCAD  Couplings, Clutches, Knuckle and cotter joints, Pipe and pipe fittings, IC engine parts, Machine tool parts, Bearings, Screw Jack, Drill press vice                                                                                         3 e Number of"
" XXX-205"," TECHNICAL COMMUNICATION"," 1 Need for Effective Communication, Overview of Technical and Professional communication  3 2 Listening Skills, Reading Skills, Writing Skills 3 3 Writing Letters, Official E-mails, Job Applications, Resumes, Cover Letters, Notes Case  6 Studies     Overview of Research Writing Information Gathering Using the Library and Intemet  12 4 Modes, Organizing and Presenting According to Audience and Purpose Writing Research Proposals, Project Technical Report/ Dissertation/Theses Writing Case Studies                                                           5 Presentation Skills, Interview Skills, Group Discussion skills, Case Studies 9  6 Technology Based Communication- Use of Visuals and Audio to Communicate Effectively  3  7 Ethics, Attitude and Team Communication 3  8 Social Media/ Online Communication, Public Speaking Developing an Authorial Voice 3  Course"
" MAN 401"," OPERATIONS RESEARCH","  Development of Operations Research, Definition of Operations Research, Characteristics of  6  1 Operations Research, Scientific method in Operations Research, Necessity of Operations Research in industry, Scope of Operations Research  2 Formulation of Linear Programming problem , Graphical Solution, Simplex Method, 12 Unrestricted variables, Artificial variables, M-Method, Dual Phase method Introduction to the Transportation model, Assumption in the Transportation Model, 6  3 Definition of the Transportation Model, Matrix terminology, Formulation and solution of Transportation Model Decision theory, Steps in Decision theory approach, Decision making environments, 6  4 Decision making under conditions of certainty, Decision making under conditions of uncertainty, Decision making under conditions of risk, Maximum likelihood criterion  5 Queuing Model, Introduction, Application of Queuing Model, Elements of Queuing System,  6 Operating characteristics of Queuing System, Waiting time and idle time costs  6 Non — Linear Programming, Introduction , Local and Global optimum, Concave and Convex  6 functions, Types of non-linear programming problems  Course"
"

 

MAN 402","

OPTIMIZATION TECHNIQUES"," LINEAR PROGRAMMING 1 Formulation, Graphical solution, Simplex method , Relation between Graphical and Simplex method, Unrestricted variables, Artificial variables, M-Method and Dual Phase  (14) method OPTIMIZATION TECHNIQUES 2 UNCONSTRAINED PROBLEMS - (Single and multivariable optimization) Necessary and sufficient conditions for extreme points (12) CONSTRAINED PROBLEMS - (multivariable optimization ) Equality constraints , Jacobian and Lagrangean methods , Application of Jacobian method to linear problems NON-LINEAR PROGRAMMING PROBLEMS Geometric Programming 3 UNCONSTRAINED ALGORITHMS - Direct methods, Dichotomous and Golden (12) search  Univariate and Hooke and Jeeves search methods  Gradient methods , Cauchy’s steepest ascent method and Newton’s method PROGRAMMING TECHNIQUES 4 Separable programming ,Geometric Programming (4) Course"
"  PYN-401","  ADVANCED PHYSICS","s     Quantum theory of light, X-rays - production, spectrum  diffraction(Bragg's Law), photoelectric effect, compton effect, pair production, photons  gravity, black holes, de- Broglie hypothesis, particle diffraction, uncertainty principle and applications  Postulates of quantum mechanics, Schrodinger theory, time-dependent and time- independent Schrodinger equation, wave function, Born interpretation and normalization, expectation values  10     Particle in a box (infinite well potential), finite potential step and barrier problems, tunneling, linear harmonic oscillator (one-dimensional)  Hydrogen atom, radiative transitions and selection rules, electron spin, Stern-Gerlach experiment, Spin-orbit coupling, exclusion principle, symmetric and anti-symmetric wave functions  Alpha decay, Zeeman Effect, Correspondence Principle, Angular Momentum in Quantum Mechanics        Natural radioactivity, successive radioactive transformations, radioactive equilibrium, radioactive series, radiometric dating  Nuclear force and its characteristics, Elementary description of shell model, explanation of magic numbers, liquid drop model and semi-empirical binding energy formula Nuclear fission, fission products, mass and energy distribution of fission products, neutron emission and energy distribution of neutrons emitted in fission, theory of fission process, nuclear reactors - classification, neutron cycle in thermal reactors and four- factor formula for neutron reproduction, nuclear fission - controlled thermonuclear reactions  Artificial radioactivity and its application, Beta-decay (energy spectrum  discovery of neutrino), fusion reactions in stars     Band theory of solids, Kronig-Penney Model (qualitative), conductors, insulators and semiconductors, p-type and n-type semiconductors, statistics of electrons and holes, Hall effect (for single as well as both type of charge carriers)     Occurrence of superconductivity, destruction of superconductivity, Meissner effect, type I and type II superconductors, heat capacity, isotope effect, thermodynamical considerations, London equations  penetration depth, coherence length, BCS theory (elementary description), applications of superconductors High temperature superconductivity, Josephson junctions              Course"
"  PYN-402","  CRYSTAL PHYSICS","     CRYSTAL STRUCTURES - Periodic array of atoms, Lattice, basis, primitive cell, two and  12 three dimensional lattice types, miller indices, examples of crystal structures (NaCl, CsCl 1 structures), Hexagonal closed packed, diamond, zinc sulfide structures, x-ray diffraction of crystal, Bragg's Law, reciprocal lattice, diffraction condition, Laue equation, structure factor, atomic form factor     CRYSTAL BINDING - van der waals interaction, repulsive interaction, equilibrium lattice  10     2 constant, cohesive energy, ionic crystals, covalent crystals, electrostatic energy, Madelung constant PHONONS AND CRYSTAL VIBRATIONS - monoatomic basis, first Brillouin zone,  10 3 dispersion relation, two atoms per primitive basis, quantization of elastic waves, phonon  momentum, inelastic scattering by phonon     THERMAL PROPERTIES - phonon heat capacity, density of states, Einstein model,  10 4 Debye model of heat capacity, inharmonic crystal interaction, thermal expansion Thermal conductivity, Umklapp Processes           Course"
